{
  "schemaVersion": 1,
  "pack": "Lampas 2",
  "version": "2.0.0",
  "minecraft": "26.2",
  "loader": {
    "type": "fabric",
    "version": "0.19.3"
  },
  "minimumLauncherVersion": "1.1.0",
  "protocol": 2,
  "created": "2026-08-26T09:15:06.308Z",
  "clientManifest": "http://localhost:3000/api/v1/releases/2.0.0/client-manifest",
  "serverManifest": "http://localhost:3000/api/v1/releases/2.0.0/server-manifest",
  "totalMods": 214,
  "totalFiles": 385,
  "launch": {
    "autoConnect": true,
    "server": "play.lampas.town:25576",
    "requiredResourcePacks": [
      {
        "id": "fa-player-extension",
        "filename": "FA+Player-v1.1.zip",
        "path": "resourcepacks/FA+Player-v1.1.zip",
        "sha256": "9ee3ae5b2fe5cd980e4041429dc66d88243f5f2420e2814e5361c746ad937f33",
        "sha1": "122e397af111e3dc5fb6b60004aad9464980f13a"
      }
    ]
  },
  "serverResourcePack": {
    "artifact": "lampas2",
    "required": true,
    "filename": "lampas2-resource-pack.zip",
    "path": "resourcepacks/lampas2-resource-pack.zip",
    "url": "http://localhost:3000/api/v1/blobs/47ce079bb26176a1bc869e79fe5d49a9cbbba8fd2be4e5ec8381e44aeff560b0",
    "sha1": "6f087e5414025491e079bd60b9bb43623cc7e337",
    "sha256": "47ce079bb26176a1bc869e79fe5d49a9cbbba8fd2be4e5ec8381e44aeff560b0",
    "prompt": "{\"text\":\"The Lampas 2 resource pack\"}",
    "id": "7af14f5a-e521-443a-9275-265decab3edc",
    "provider": "lampas"
  }
}